[
  {
    "name": "Aceterniry",
    "domain": "aceterniry.com",
    "status": "Trusted",
    "updatedAt": "2026-04-12"
  },
  {
    "name": "Shadcnblocks",
    "domain": "shadcnblocks.com",
    "status": "Trusted",
    "updatedAt": "2026-04-20"
  },
  {
    "name": "Lexington Themes",
    "domain": "lexingtonthemes.com",
    "status": "Trusted",
    "updatedAt": "2026-04-18"
  },
  {
    "name": "Tailark",
    "domain": "tailark.com",
    "status": "Trusted",
    "updatedAt": "2026-04-12"
  },
  {
    "name": "Wicked Blocks",
    "domain": "wickedbocks.dev",
    "status": "Trusted",
    "updatedAt": "2026-04-20"
  },
  {
    "name": "Oxbow UI",
    "domain": "oxbowui.com",
    "status": "Trusted",
    "updatedAt": "2026-04-20"
  },
  {
    "name": "Wicked Templates",
    "domain": "wickedtemplates.com",
    "status": "Trusted",
    "updatedAt": "2026-04-20"
  },
  {
    "name": "Bearnie",
    "domain": "bearnie.dev",
    "status": "Trusted",
    "updatedAt": "2026-04-20"
  },
  {
    "name": "Aumata",
    "domain": "aumata.ai",
    "status": "Removed",
    "updatedAt": "2026-04-20"
  }
]
